{
  "$schema": "../../../schemas/task-record.schema.json",
  "task_id": "pilot.ru.mysticism-article",
  "revision": "1",
  "subject": "Недосказанность как основной механизм мистической истории",
  "central_question": "Почему ограниченная и последовательная неизвестность может делать мистическую историю сильнее прямого объяснения?",
  "reader_promise": "Читатель поймёт, из каких элементов складывается работающая мистическая недосказанность и где тайна превращается в пустую туманность.",
  "primary_job": "critical-analysis",
  "artifact_form": "article",
  "assessments": {
    "source_freshness": "not-applicable",
    "platform_constraints": "known",
    "perspective": "authorized",
    "rights": "cleared"
  },
  "sources": [
    {
      "id": "SRC-001",
      "title": "Entertainment Topic Foundation",
      "role": "Правила критического анализа жанрового материала",
      "location": "rules/topic/entertainment/foundation.md",
      "version": "repository revision",
      "status": "draft runtime module",
      "scope": "Разделение наблюдения, интерпретации, критерия и ограниченного суждения",
      "rights": "repository license"
    },
    {
      "id": "SRC-002",
      "title": "Article Format Foundation",
      "role": "Структура и критерии завершённости статьи",
      "location": "rules/format/article/foundation.md",
      "version": "repository revision",
      "status": "draft runtime module",
      "scope": "Проектирование и редактирование длинной формы",
      "rights": "repository license"
    },
    {
      "id": "SRC-003",
      "title": "Visual and Illustration Integrity",
      "role": "Границы оригинальной редакционной иллюстрации",
      "location": "rules/visual/illustration-integrity.md",
      "version": "repository revision",
      "status": "draft runtime module",
      "scope": "Недокументальный визуал, права, alt text и provenance",
      "rights": "repository license"
    }
  ],
  "claims": [
    {
      "id": "C-001",
      "text": "В рамках выбранного критерия мистическая недосказанность работает, когда история оставляет несколько возможных объяснений, но сохраняет устойчивые последствия и ограничения.",
      "classification": "inference",
      "material": true,
      "source_ids": [
        "SRC-001",
        "SRC-002"
      ],
      "qualification": "Это редакционная интерпретация механики повествования, а не универсальный психологический закон.",
      "disposition": "use"
    },
    {
      "id": "C-002",
      "text": "Конкретный след события может поддерживать мистическое напряжение лучше, чем дополнительное объяснение, если сам след не доказывает единственную причину.",
      "classification": "inference",
      "material": true,
      "source_ids": [
        "SRC-001"
      ],
      "qualification": "Вывод ограничен анализом повествовательной формы и не описывает измеренную реакцию всех читателей.",
      "disposition": "use"
    },
    {
      "id": "C-003",
      "text": "Полное объяснение в финале может ослабить мистическую историю, когда оно заменяет пространство интерпретации одной буквальной инструкцией.",
      "classification": "opinion",
      "material": true,
      "source_ids": [
        "SRC-001",
        "SRC-002"
      ],
      "qualification": "Это заявленный редакционный критерий, а не обязательное правило для каждого произведения.",
      "disposition": "use"
    },
    {
      "id": "C-004",
      "text": "Неоднозначные финалы всегда пугают любого читателя сильнее однозначных.",
      "classification": "unknown",
      "material": false,
      "source_ids": [],
      "qualification": "Универсальное утверждение не подтверждено и не требуется для тезиса статьи.",
      "disposition": "omit"
    }
  ],
  "media": {
    "decision": "selected",
    "reason": "Атмосферная обложка визуально показывает границу между видимым следом и неизвестной причиной, не добавляя фактов.",
    "brief": {
      "purpose": "Создать редакционную рамку для статьи о недосказанности: показать видимый след и скрытую причину.",
      "reader_benefit": "Обложка настраивает на тему неизвестности, не изображая конкретное сверхъестественное существо.",
      "evidence_basis": "Тезисы C-001 и C-002 и правило визуальной целостности.",
      "must_not_imply": [
        "что изображено реальное место",
        "что сверхъестественное событие документально подтверждено",
        "что за дверью находится конкретное существо",
        "что иллюстрация относится к существующему фильму, книге или игре"
      ],
      "asset_type": "оригинальная атмосферная редакционная обложка",
      "acceptance_criteria": [
        "в кадре нет людей, персонажей, логотипов и текста",
        "источник тревоги остаётся неоднозначным",
        "визуал не выглядит документальной фотографией",
        "композиция пригодна для широкого заголовочного изображения",
        "caption и alt text обозначают концептуальный характер изображения"
      ]
    }
  }
}
